<?xml version="1.0" encoding="UTF-8"?>
<!-- W3C Schema generated by XMLSpy v2014 rel. 2 sp1 (http://www.altova.com) -->
<xs:schema xmlns:xs="http://www.w3.org/2001/XMLSchema">
	<xs:element name="Translation-List">
		<xs:complexType>
			<xs:sequence>
				<xs:element name="Translation" maxOccurs="unbounded">
					<xs:complexType>
						<xs:sequence>
							<xs:element name="ID" type="xs:byte"/>
							<xs:element name="Language" type="xs:string"/>
							<xs:element name="Value" type="xs:string"/>
						</xs:sequence>
					</xs:complexType>
				</xs:element>
			</xs:sequence>
		</xs:complexType>
	</xs:element>
</xs:schema>
